{
  "slug": "growth-model",
  "title": "Growth Model",
  "tier": "core",
  "description": "Financial modeling integrating ARR targets with GTM efficiency metrics to create achievable quarterly revenue goals.",
  "status": "published",
  "competencyIds": [
    "PL-1",
    "PL-3"
  ],
  "loomEmbedId": "445326aeb33f492bb24c4bb2dbdd87dc"
}
