{
  "slug": "gtm-org-chart-roles-and-hiring-plan",
  "title": "GTM Org Chart, Roles & Hiring Plan",
  "tier": "extended",
  "description": "Design GTM org structure and hiring roadmap.",
  "status": "published",
  "competencyIds": [
    "PL-2",
    "PE-1",
    "PE-2",
    "PE-3",
    "PE-5",
    "PE-6"
  ],
  "loomEmbedId": null
}
