{
  "slug": "automated-inbound",
  "title": "Automated Inbound Data Enrichment",
  "tier": "core",
  "description": "Automate lead enrichment with firmographic and technographic data.",
  "status": "published",
  "competencyIds": [
    "SY-6"
  ],
  "loomEmbedId": "391ee5002e5d4104b09014008d490d81"
}
