{
  "slug": "marketing-automation-platform-implementation",
  "title": "Marketing Automation Platform Implementation",
  "tier": "extended",
  "description": "Implement and configure marketing automation platform.",
  "status": "published",
  "competencyIds": [
    "SY-2"
  ],
  "loomEmbedId": null
}
